"Con la entrega de las granjas solares Canal del Dique, en Bolívar, y Castilla la Nueva en San Fernando, Meta, multiplicamos por 15 la capacidad instalada que recibimos cuando empezó nuestro Gobierno. La revolución de #EnergíasRenovables es una realidad en Colombia #LaNuevaEnergía https://t.co/Lhfh7lAecg"
"Avanzamos con la #TransiciónEnergética. Acompañamos la inauguración del parque Solar Canal del Dique, la planta de autogeneración de energía a gran escala en funcionamiento más grande de la región del Caribe colombiano. @promigasoficial. #LaNuevaEnergía https://t.co/nYnIjbPeVU"
"Siguen cayendo los criminales que afectan la seguridad de la población. Gracias a las labores de nuestra #FuerzaPública fue capturado en Bogotá, John Carlos Rincón, alias 'Colacho' o 'Nicolás', cabecilla principal de las disidencias de las Farc que delinquía en el sur de Bolívar."
"En el Encuentro Internacional de Defensores del Pueblo destacamos el valor de su trabajo por las comunidades más vulnerables y los invitamos a que construyamos, entre todos, un marco que nos permita atender la migración y la defensa de la democracia en la región. https://t.co/HlpSgOCNIX"
"Sin ninguna duda digo que si tuviera que volver a implementar la política pública del #EstatutoDeProtecciónTemporal, lo haría una y mil veces. En esta coyuntura debemos reconocer que la fraternidad debe ser la base global para brindar oportunidades de vida a quienes lo necesitan. https://t.co/QQFONZyS56"
"Nos complace participar en Encuentro Internacional de Defensores del Pueblo ‘Migración y Refugio’, de la @DefensoriaCol, vital por la cruda crisis humanitaria que viven 1,8 millones de venezolanos, a quienes les hemos respondido con fraternidad #EstatutoTemporalDeProtección https://t.co/xuORoMrGz3"
"La misión de #IA, compuesta por 10 expertos mundiales, consolida nuestra apuesta por el liderazgo de la transformación digital en la región. Seguiremos trabajando como Gobierno para lograr mayor equidad, bajo los pilares de la tecnología, el emprendimiento y la legalidad. https://t.co/LPBh1tcEGb"
"La Misión de Expertos de #InteligenciaArtificial que hoy le presentamos a Colombia facilitará la formulación de políticas públicas que nos permitan avanzar en este campo, bajo criterios de humanidad, eficiencia, e inclusión. Un país digital, es símbolo de equidad. https://t.co/e91r2Yj0N7"
"Si bien hoy vemos aplicada la #InteligenciaArtificial en temas de desarrollo como salud o movilidad, se convierte en herramienta eficaz de lucha contra la corrupción, alertando irregularidades en procesos de contratación y, también, nos permite enfrentar ataques de ciberseguridad https://t.co/eOO4Mm1vP4"
"En nuestro objetivo de que Colombia esté a la vanguardia de los desafíos de la #4RI y tener una hoja de ruta tecnológica, asistimos al lanzamiento de la Misión de Expertos en #InteligenciaArtificial, integrada por especialistas de Suiza, India, Argentina, Canadá, Chile y Colombia https://t.co/azmtDLhJdD"
"En el reconocimiento a #ElColombianoEjemplar destacamos a hombres y mujeres que sobresalen por sus acciones y podemos decir que toda Colombia es un ejemplo de resiliencia, porque enfrenta las adversidades y las convierte en oportunidades. Ese es el talante de nuestro país. https://t.co/j36JXxYZDX"
"En nuestro propósito de avanzar en el desarrollo y producción de vacunas en Colombia, no solo para covid-19 sino para otras patologías, asistimos a la firma del memorando de entendimiento con @InovioPharma, acuerdo que se consolida luego de nuestra visita a Estados Unidos. https://t.co/qyyLg0sEAN"
"El encuentro con @StateDept, @SecBlinken, reafirma nuestra relación bilateral, de países amigos, aliados y hermanos en la defensa de principios y valores, porque hoy Colombia y Estados Unidos avanzamos para que esta relación llegue a un nuevo nivel en los próximos años. https://t.co/sFhQZpJIE7"
".@SecBlinken ratificó que EEUU está comprometido con la implementación de nuestra política de #PazConLegalidad y destacó avances significativos como el catastro multipropósito, las 16 curules para las víctimas, la titulación de tierras y el desminado humanitario. https://t.co/mFP6GD7QHb"
"La visita del @SecBlinken a Colombia es muestra de la solidez de nuestra relación histórica de 200 años con EE.UU. Ratifica el trabajo conjunto y permanente con el Presidente @POTUS, quien ve en Colombia un amigo y uno de los aliados más importantes en la región. https://t.co/gO2saHNBCE"
"Recibimos con aprecio el reconocimiento de @StateDept, @SecBlinken, al #EstatutoDeProtecciónTemporal, que reafirma que esta política migratoria es fraterna y ejemplo para el mundo. Brindar oportunidades de vida a 1,8 millones de venezolanos que huyen de su país es un deber moral. https://t.co/1pJmADGGte"
"Productiva reunión de alto nivel con el @StateDept, @SecBlinken, en la que abordamos importantes temas para el país y el hemisferio. Esta visita consolida casi 200 años de relación fraterna y estratégica. Nos complace seguir siendo un gran aliado de EEUU en la región. https://t.co/O15HZPSdTq"
"Le damos la bienvenida a Colombia al @StateDept, @SecBlinken, con quien sostendremos agenda de trabajo en temas como defensa de la democracia en la región, crisis migratoria, lucha contra el narcotráfico, mitigación de la crisis climática y nuestra política de #PazConLegalidad. https://t.co/Wi3L7Bw5n5"
"Posesionamos a @CarmenLigiaV como nueva @Ministerio_TIC, una gran profesional, con amplia trayectoria en los sectores público y privado, quien tiene el reto de consolidar que el 70% del país tenga conectividad con internet de alta velocidad. Esto es Equidad. https://t.co/GegsFqical"
"La sociedad debe defender la democracia, la empresa y el emprendimiento, del populismo y la demagogia. Ante #ColombiaInvestmentSummit2021 ratificamos nuestro apoyo, impulso, confianza e invitación a la inversión y la generación de empleo, esto es creer y apostar por Colombia. https://t.co/xYUr9hHm5F"
"En #ColombiaInvestmentSummit2021 destacamos esa Colombia resiliente, que sale de recesión causada por la pandemia y registra el mejor trimestre en crecimiento económico de este siglo. No hay duda, la inversión extranjera está en marcha, acompañada de políticas públicas coherentes https://t.co/jMcYc7WtVu"
"Participamos en apertura del #ColombiaInvestmentSummit2021 de @PROCOLOMBIACO, con trascendentales anuncios para el país. Durante nuestro Gobierno hemos logrado atraer inversión extranjera por 32.000 millones de dólares en más de 610 proyectos. Avanzamos en la #ReactivaciónSegura https://t.co/QdchlWeM83"
"Culmina nuestra #VisitaOficialABrasil con importantes logros: fortalecimiento de las relaciones binacionales, mayor inversión, cooperación en ciencia y tecnología; seguridad y defensa y sector agropecuario. Gracias Brasil, nos llena de orgullo trabajar como países hermanos. https://t.co/bV4RKi0vLq"
"Con @rpsenador, Presidente del @SenadoFederal, sostuvimos grato encuentro en el que coincidimos que nuestros países defienden la democracia, la libertad y trabajan por el medioambiente. Además, reafirmamos el compromiso de velar por seguridad en la frontera. #VisitaOficialABrasil https://t.co/NeqZW8vR0q"
"En la #VisitaOficialABrasil nos reunimos con el Presidente de @camaradeputados, @ArthurLira_, a quien le agradecimos la relación de hermandad de nuestros países, que se fortalece con más comercio, inversión, impulso a industrias creativas, así como protección de nuestra Amazonía. https://t.co/nQJTFbUMDx"
"Las cifras reveladas por el @DANE_Colombia reafirman que la #ReactivaciónEconómica sigue avanzando. En agosto de 2021, el Índice de Seguimiento a la Economía #ISE, creció 13,2% frente al mismo mes del 2020, impulsado principalmente por actividades de comercio y servicios."
"En el #DíaInternacionalDelCáncerDeMama reafirmamos la importancia de detectar y tratar oportunamente esta enfermedad, que en el 2020 le fue diagnosticada a más de 15 mil mujeres en Colombia. Como Gobierno continuamos impulsando políticas públicas de prevención y atención integral"
"En el #DíaInternacionalDelCáncerDeMama reafirmamos la importancia de detectar y tratar oportunamente esta enfermedad, que en el 2020 le fue diagnosticada a más de 15 mil mujeres en Colombia. Como Gobierno continuamos impulsando políticas públicas de prevención y atención integral"
"Durante nuestra #VisitaOficialABrasil logramos materializar compromisos por más de USD1.400 millones, y vemos, con mucha ilusión, que hoy nuestras relaciones bilaterales llegan a un nuevo punto, con la posibilidad de abrir nuevos mercados en diversos sectores como el agropecuario https://t.co/1XsZgetvns"
"También, en el marco del fortalecimiento de las relaciones, se firmaron memorandos de entendimiento entre @PROCOLOMBIACO y Apex-Brasil; de cooperación en agua y saneamiento; apoyo a mipymes; cooperación agrícola, y de investigación y desarrollo científico. #VisitaOficialABrasil"
"Las relaciones bilaterales con Brasil están en su mejor momento y con el Presidente @jairbolsonaro asistimos a las firmas de acuerdos entre nuestras naciones. El primero, entre las policías de Brasil y Colombia, y el segundo de servicios aéreos. #VisitaOficialABrasil https://t.co/5oWdYEjMnM"
"Coincidimos plenamente con el Presidente @jairbolsonaro que las relaciones bilaterales tienen todo para crecer por el beneficio de nuestros pueblos y seguimos trabajando en salud, educación, seguridad, ciencia, tecnología y lucha contra la crisis climática. #VisitaOficialABrasil https://t.co/3pLInZ12bQ"
"Muy grato encuentro con el Presidente @jairbolsonaro y su equipo de Gobierno, con quienes abordamos temas claves para las relaciones bilaterales, que alcanzan el punto más alto. Comercio, seguridad, salud, agroindustria, inversión, tecnología y medioambiente #VisitaOficialABrasil https://t.co/RxeeVIYEA1"
"En nuestra #VisitaOficialABrasil llegamos al Palacio de Planalto, donde nos reuniremos con el Presidente @jairbolsonaro, un gran amigo de Colombia, con quien hablaremos de nuestras históricas relaciones y el fortalecimiento del comercio, cultura y lucha contra la crisis climática https://t.co/cVhOpbf5pj"
"Para cerrar las brechas de educación entre la ciudad y el campo, nos interesa vincular las experiencias de Brasil, que se suma a nuestra apuesta por la transformación rural integral, que incluye inversiones en electrificación, vías terciarias y agua potable. #VisitaOficialABrasil https://t.co/ECSCYTRZQD"
"Queremos un mayor crecimiento de nuestro agro. Para esto, propusimos a empresarios de este sector en Brasil trabajar en alianza en ciencia e investigación, con @embrapa, para prevenir y enfrentar amenazas en cultivos de café y caña, y mejorar productividad. #VisitaOficialABrasil https://t.co/GzoNogNrbc"
"Con Brasil tenemos en el agro uno de los principales segmentos de la economía, con gran aporte al PIB. Por eso, el encuentro con el sector de agronegocios sirve para que, unidos, crezcamos y desarrollemos la industria rural con más inversión y tecnificación. #VisitaOficialABrasil https://t.co/swrHB1zcl5"
"El primer día de la #VisitaOficialABrasil dejó un gran balance: más de USD 1.400 millones de inversión para dos años y el fortalecimiento de la relación bilateral en comercio, integración, sostenibilidad energética, medioambiente y financiamiento de megaproyectos. https://t.co/sVtQcPLPIA"
"Sostuvimos una maravillosa conversación con representantes de Embraer, y tenemos una gran noticia: ellos están mirando compañías colombianas para que sean proveedoras de aeropartes, lo que, sin duda, impulsa una industria naciente del país en la región. #VisitaOficialABrasil https://t.co/jaFI8AZeHh"
"En nuestra #VisitaOficialABrasil, mañana firmaremos seis convenios de vital importancia que van desde los temas de seguridad, para la lucha contra crimen transnacional, hasta la formación para el trabajo y el papel de las empresas, así como en turismo, ciencia y tecnología. https://t.co/di0LwPAehT"
"Con el Presidente @jairbolsonaro reconocemos que los valores y principios entre nuestros países son más fuertes que nunca, y hoy Brasil y Colombia somos garantes de la iniciativa privada con sentido social y defensores de la democracia en el hemisferio. #VisitaOficialABrasil https://t.co/S4JBM7wYVL"
"Una vez más el Estado colombiano rechaza toda agresión física y psicológica contra las mujeres. @jbedoyalima jamás debió ser secuestrada y torturada. La sentencia de la @CorteIDH se cumplirá en su totalidad, como siempre Colombia lo ha hecho."
"Como presidente de los colombianos siempre condenaré cualquier acto violento contra mujeres y periodistas. El caso de @jbedoyalima no puede repetirse jamás. Esta sentencia debe servirnos de guía en las acciones a implementar para evitar que algo similar vuelva a suceder."
"Colombia acata plenamente la sentencia de la @CorteIDH en el caso de @jbedoyalima. Celebro que la Corte haya ordenado la creación de un centro de memoria y dignificación de las mujeres víctimas de violencia sexual en el marco del conflicto armado y del periodismo investigativo."
